{
  "schema_version": "calendar-coverage-observation-v1",
  "run_id": "due-job-plan-2026-08-09-due-japan-nar-coverage-gap-001-run-001",
  "system_id": "japan-nar-system",
  "source_id": "nar-schedule-detail-batch",
  "checked_at": "2026-08-09T05:21:47.257Z",
  "requested_scope": {
    "kind": "date_window",
    "start_date": "2026-09-07",
    "end_date_exclusive": "2026-09-08",
    "timezone": "Asia/Tokyo"
  },
  "observed_scope": {
    "kind": "date_window",
    "start_date": "2026-09-07",
    "end_date_exclusive": "2026-09-08",
    "timezone": "Asia/Tokyo"
  },
  "collection_mode": "date_window",
  "records_discovered": 3,
  "records_updated": 3,
  "unresolved_dates": [
    "2026-09-07"
  ],
  "unresolved_meeting_ids": [
    "nar-kawasaki-racecourse-2026-09-07",
    "nar-mizusawa-racecourse-2026-09-07",
    "nar-nagoya-racecourse-2026-09-07"
  ],
  "source_errors": [],
  "coverage_claim": "source_window_complete",
  "completion_audit_ref": null
}
