{
  "schema_version": "calendar-coverage-observation-v1",
  "run_id": "due-job-plan-2026-09-01-due-japan-nar-regular-refresh-001-run-001",
  "system_id": "japan-nar-system",
  "source_id": "nar-schedule-detail-batch",
  "checked_at": "2026-09-01T04:29:41.246Z",
  "requested_scope": {
    "kind": "date_window",
    "start_date": "2026-09-02",
    "end_date_exclusive": "2026-09-16",
    "timezone": "Asia/Tokyo"
  },
  "observed_scope": {
    "kind": "date_window",
    "start_date": "2026-09-02",
    "end_date_exclusive": "2026-09-16",
    "timezone": "Asia/Tokyo"
  },
  "collection_mode": "date_window",
  "records_discovered": 50,
  "records_updated": 50,
  "unresolved_dates": [
    "2026-09-04",
    "2026-09-05",
    "2026-09-06",
    "2026-09-07",
    "2026-09-08",
    "2026-09-09",
    "2026-09-10",
    "2026-09-11",
    "2026-09-12",
    "2026-09-13",
    "2026-09-14",
    "2026-09-15"
  ],
  "unresolved_meeting_ids": [
    "nar-kanazawa-racecourse-2026-09-06",
    "nar-kanazawa-racecourse-2026-09-08",
    "nar-kanazawa-racecourse-2026-09-13",
    "nar-kanazawa-racecourse-2026-09-15",
    "nar-kasamatsu-racecourse-2026-09-08",
    "nar-kasamatsu-racecourse-2026-09-09",
    "nar-kasamatsu-racecourse-2026-09-10",
    "nar-kasamatsu-racecourse-2026-09-11",
    "nar-kawasaki-racecourse-2026-09-07",
    "nar-kawasaki-racecourse-2026-09-08",
    "nar-kawasaki-racecourse-2026-09-09",
    "nar-kawasaki-racecourse-2026-09-10",
    "nar-kawasaki-racecourse-2026-09-11",
    "nar-kochi-racecourse-2026-09-05",
    "nar-kochi-racecourse-2026-09-06",
    "nar-kochi-racecourse-2026-09-12",
    "nar-kochi-racecourse-2026-09-13",
    "nar-mizusawa-racecourse-2026-09-06",
    "nar-mizusawa-racecourse-2026-09-07",
    "nar-mizusawa-racecourse-2026-09-08",
    "nar-mizusawa-racecourse-2026-09-13",
    "nar-mizusawa-racecourse-2026-09-14",
    "nar-mizusawa-racecourse-2026-09-15",
    "nar-monbetsu-racecourse-2026-09-08",
    "nar-monbetsu-racecourse-2026-09-09",
    "nar-monbetsu-racecourse-2026-09-10",
    "nar-monbetsu-racecourse-2026-09-15",
    "nar-nagoya-racecourse-2026-09-04",
    "nar-nagoya-racecourse-2026-09-07",
    "nar-nagoya-racecourse-2026-09-14",
    "nar-nagoya-racecourse-2026-09-15",
    "nar-oi-racecourse-2026-09-14",
    "nar-oi-racecourse-2026-09-15",
    "nar-saga-racecourse-2026-09-05",
    "nar-saga-racecourse-2026-09-06",
    "nar-saga-racecourse-2026-09-12",
    "nar-sonoda-racecourse-2026-09-09",
    "nar-sonoda-racecourse-2026-09-10",
    "nar-sonoda-racecourse-2026-09-11"
  ],
  "source_errors": [],
  "coverage_claim": "source_window_complete",
  "completion_audit_ref": null
}
