{
  "schema_version": "calendar-coverage-observation-v1",
  "run_id": "due-job-plan-2026-08-09-due-hong-kong-hkjc-season-wake-up-001-run-001",
  "system_id": "hong-kong-hkjc-system",
  "source_id": "hkjc-fixture-list",
  "checked_at": "2026-08-09T05:21:43.353Z",
  "requested_scope": {
    "kind": "date_window",
    "start_date": "2026-09-07",
    "end_date_exclusive": "2026-09-08",
    "timezone": "Asia/Hong_Kong"
  },
  "observed_scope": {
    "kind": "date_window",
    "start_date": "2026-09-07",
    "end_date_exclusive": "2026-09-08",
    "timezone": "Asia/Hong_Kong"
  },
  "collection_mode": "date_window",
  "records_discovered": 0,
  "records_updated": 0,
  "unresolved_dates": [],
  "unresolved_meeting_ids": [],
  "source_errors": [],
  "coverage_claim": "source_window_complete",
  "completion_audit_ref": null
}
